Checking Python syntax compilation...
[OK] All files compile successfully
All checks passed!
src/infrastructure/rag/store_manager.py:21: note: By default the bodies of untyped functions are not checked, consider using --check-untyped-defs  [annotation-unchecked]
src/infrastructure/rag/store_manager.py:22: note: By default the bodies of untyped functions are not checked, consider using --check-untyped-defs  [annotation-unchecked]
src/context.py:207: note: By default the bodies of untyped functions are not checked, consider using --check-untyped-defs  [annotation-unchecked]
src/context.py:208: note: By default the bodies of untyped functions are not checked, consider using --check-untyped-defs  [annotation-unchecked]
Success: no issues found in 244 source files
============================= test session starts ==============================
platform linux -- Python 3.13.7, pytest-8.4.2, pluggy-1.6.0 -- /home/nate/.cache/pypoetry/virtualenvs/insighthub-G9Cf3wlO-py3.13/bin/python
cachedir: .pytest_cache
rootdir: /home/nate/projects/insighthub
configfile: pyproject.toml
plugins: anyio-4.11.0, returns-0.26.0, cov-4.1.0
collecting ... collected 32 items

tests/unit/infrastructure/rag/test_options.py::test_get_rag_type_options_returns_expected_types PASSED [  3%]
tests/unit/infrastructure/rag/test_options.py::test_get_chunking_options_returns_expected_types PASSED [  6%]
tests/unit/infrastructure/rag/test_options.py::test_get_embedding_options_returns_expected_types PASSED [  9%]
tests/unit/infrastructure/rag/test_options.py::test_get_reranking_options_returns_expected_types PASSED [ 12%]
tests/unit/infrastructure/rag/test_options.py::test_get_graph_entity_extraction_options_returns_expected_types PASSED [ 15%]
tests/unit/infrastructure/rag/test_options.py::test_get_graph_relationship_extraction_options_returns_expected_types PASSED [ 18%]
tests/unit/infrastructure/rag/test_options.py::test_get_graph_clustering_options_returns_expected_types PASSED [ 21%]
tests/unit/infrastructure/rag/test_options.py::test_get_default_rag_type_returns_expected_default PASSED [ 25%]
tests/unit/infrastructure/rag/test_options.py::test_get_default_chunking_algorithm_returns_expected_default PASSED [ 28%]
tests/unit/infrastructure/rag/test_options.py::test_get_default_embedding_algorithm_returns_expected_default PASSED [ 31%]
tests/unit/infrastructure/rag/test_options.py::test_get_default_reranking_algorithm_returns_expected_default PASSED [ 34%]
tests/unit/infrastructure/rag/test_options.py::test_get_default_entity_extraction_algorithm_returns_expected_default PASSED [ 37%]
tests/unit/infrastructure/rag/test_options.py::test_get_default_relationship_extraction_algorithm_returns_expected_default PASSED [ 40%]
tests/unit/infrastructure/rag/test_options.py::test_get_default_clustering_algorithm_returns_expected_default PASSED [ 43%]
tests/unit/infrastructure/rag/test_options.py::test_is_valid_rag_type_returns_correct_boolean[vector-True] PASSED [ 46%]
tests/unit/infrastructure/rag/test_options.py::test_is_valid_rag_type_returns_correct_boolean[graph-True] PASSED [ 50%]
tests/unit/infrastructure/rag/test_options.py::test_is_valid_rag_type_returns_correct_boolean[invalid-False] PASSED [ 53%]
tests/unit/infrastructure/rag/test_options.py::test_is_valid_rag_type_returns_correct_boolean[-False] PASSED [ 56%]
tests/unit/infrastructure/rag/test_options.py::test_is_valid_rag_type_returns_correct_boolean[None-False] PASSED [ 59%]
tests/unit/infrastructure/rag/test_options.py::test_get_valid_rag_types_returns_expected_list PASSED [ 62%]
tests/unit/infrastructure/rag/test_options.py::test_is_valid_chunking_algorithm_returns_correct_boolean[sentence-True] PASSED [ 65%]
tests/unit/infrastructure/rag/test_options.py::test_is_valid_chunking_algorithm_returns_correct_boolean[token-True] PASSED [ 68%]
tests/unit/infrastructure/rag/test_options.py::test_is_valid_chunking_algorithm_returns_correct_boolean[markdown-True] PASSED [ 71%]
tests/unit/infrastructure/rag/test_options.py::test_is_valid_chunking_algorithm_returns_correct_boolean[html-True] PASSED [ 75%]
tests/unit/infrastructure/rag/test_options.py::test_is_valid_chunking_algorithm_returns_correct_boolean[code-True] PASSED [ 78%]
tests/unit/infrastructure/rag/test_options.py::test_is_valid_chunking_algorithm_returns_correct_boolean[invalid-False] PASSED [ 81%]
tests/unit/infrastructure/rag/test_options.py::test_is_valid_chunking_algorithm_returns_correct_boolean[-False] PASSED [ 84%]
tests/unit/infrastructure/rag/test_options.py::test_is_valid_chunking_algorithm_returns_correct_boolean[None-False] PASSED [ 87%]
tests/unit/infrastructure/rag/test_store_manager.py::TestRAGStoreManager::test_get_graph_store_caches_by_config PASSED [ 90%]
tests/unit/infrastructure/rag/test_store_manager.py::TestRAGStoreManager::test_get_vector_store_caches_by_config PASSED [ 93%]
tests/unit/infrastructure/rag/test_store_manager.py::TestRAGStoreManager::test_graph_cache_key_generation PASSED [ 96%]
tests/unit/infrastructure/rag/test_store_manager.py::TestRAGStoreManager::test_vector_cache_key_generation PASSED [100%]

---------- coverage: platform linux, python 3.13.7-final-0 -----------
Name                                                                                            Stmts   Miss  Cover
-------------------------------------------------------------------------------------------------------------------
src/__init__.py                                                                                     0      0   100%
src/__main__.py                                                                                     3      3     0%
src/cache_keys.py                                                                                  32     32     0%
src/cli.py                                                                                        194    194     0%
src/config.py                                                                                     195    195     0%
src/context.py                                                                                    119    119     0%
src/domains/__init__.py                                                                             0      0   100%
src/domains/default_rag_config/__init__.py                                                          4      4     0%
src/domains/default_rag_config/commands.py                                                         99     99     0%
src/domains/default_rag_config/data_access.py                                                      46     46     0%
src/domains/default_rag_config/dtos.py                                                             57     57     0%
src/domains/default_rag_config/mappers.py                                                           8      8     0%
src/domains/default_rag_config/models.py                                                           36     36     0%
src/domains/default_rag_config/orchestrator.py                                                     44     44     0%
src/domains/default_rag_config/repositories.py                                                     20     20     0%
src/domains/default_rag_config/service.py                                                          42     42     0%
src/domains/default_rag_config/validation.py                                                       62     62     0%
src/domains/rag_options/__init__.py                                                                 2      2     0%
src/domains/rag_options/commands.py                                                                44     44     0%
src/domains/rag_options/dtos.py                                                                    13     13     0%
src/domains/rag_options/orchestrator.py                                                            10     10     0%
src/domains/rag_options/service.py                                                                 15     15     0%
src/domains/state/__init__.py                                                                       4      4     0%
src/domains/state/commands.py                                                                      29     29     0%
src/domains/state/data_access.py                                                                   46     46     0%
src/domains/state/dtos.py                                                                           7      7     0%
src/domains/state/models.py                                                                        11     11     0%
src/domains/state/orchestrator.py                                                                  10     10     0%
src/domains/state/repositories.py                                                                  18     18     0%
src/domains/state/service.py                                                                       26     26     0%
src/domains/workspace/__init__.py                                                                   0      0   100%
src/domains/workspace/chat/__init__.py                                                              2      2     0%
src/domains/workspace/chat/message/__init__.py                                                      4      4     0%
src/domains/workspace/chat/message/commands.py                                                     46     46     0%
src/domains/workspace/chat/message/data_access.py                                                  85     85     0%
src/domains/workspace/chat/message/dtos.py                                                         21     21     0%
src/domains/workspace/chat/message/mappers.py                                                       8      8     0%
src/domains/workspace/chat/message/models.py                                                       15     15     0%
src/domains/workspace/chat/message/orchestrator.py                                                 30     30     0%
src/domains/workspace/chat/message/repositories.py                                                 56     56     0%
src/domains/workspace/chat/message/service.py                                                     110    110     0%
src/domains/workspace/chat/message/validation.py                                                   22     22     0%
src/domains/workspace/chat/service.py                                                               8      8     0%
src/domains/workspace/chat/session/__init__.py                                                      4      4     0%
src/domains/workspace/chat/session/commands.py                                                     78     78     0%
src/domains/workspace/chat/session/data_access.py                                                  99     99     0%
src/domains/workspace/chat/session/dtos.py                                                         30     30     0%
src/domains/workspace/chat/session/mappers.py                                                       8      8     0%
src/domains/workspace/chat/session/models.py                                                       15     15     0%
src/domains/workspace/chat/session/orchestrator.py                                                 51     51     0%
src/domains/workspace/chat/session/repositories.py                                                 60     60     0%
src/domains/workspace/chat/session/service.py                                                      58     58     0%
src/domains/workspace/chat/session/validation.py                                                   52     52     0%
src/domains/workspace/commands.py                                                                 160    160     0%
src/domains/workspace/data_access.py                                                              157    157     0%
src/domains/workspace/document/__init__.py                                                          3      3     0%
src/domains/workspace/document/commands.py                                                         98     98     0%
src/domains/workspace/document/data_access.py                                                      97     97     0%
src/domains/workspace/document/dtos.py                                                             26     26     0%
src/domains/workspace/document/mappers.py                                                           7      7     0%
src/domains/workspace/document/models.py                                                           29     29     0%
src/domains/workspace/document/orchestrator.py                                                     44     44     0%
src/domains/workspace/document/repositories.py                                                     82     82     0%
src/domains/workspace/document/service.py                                                         108    108     0%
src/domains/workspace/document/validation.py                                                       59     59     0%
src/domains/workspace/dtos.py                                                                      87     87     0%
src/domains/workspace/mappers.py                                                                   24     24     0%
src/domains/workspace/models.py                                                                    82      5    94%
src/domains/workspace/orchestrator.py                                                              78     78     0%
src/domains/workspace/repositories.py                                                             143    120    16%
src/domains/workspace/service.py                                                                  125    125     0%
src/domains/workspace/validation.py                                                                32     32     0%
src/infrastructure/__init__.py                                                                      0      0   100%
src/infrastructure/cache/__init__.py                                                                2      0   100%
src/infrastructure/cache/cache.py                                                                  12      5    58%
src/infrastructure/cache/factory.py                                                                10      6    40%
src/infrastructure/cache/in_memory_cache.py                                                        41     30    27%
src/infrastructure/cache/redis_cache.py                                                            52     42    19%
src/infrastructure/cli_io.py                                                                       15     15     0%
src/infrastructure/graph_stores/__init__.py                                                         3      0   100%
src/infrastructure/graph_stores/factory.py                                                         17     11    35%
src/infrastructure/graph_stores/graph_store.py                                                     46     14    70%
src/infrastructure/graph_stores/neo4j_graph_store.py                                              164    164     0%
src/infrastructure/llm/__init__.py                                                                 17      2    88%
src/infrastructure/llm/claude_llm_provider.py                                                      82     82     0%
src/infrastructure/llm/factory.py                                                                  33     29    12%
src/infrastructure/llm/huggingface_embedding_provider.py                                           33     33     0%
src/infrastructure/llm/huggingface_llm_provider.py                                                 73     58    21%
src/infrastructure/llm/llm_provider.py                                                             19      5    74%
src/infrastructure/llm/ollama_llm_provider.py                                                      71     57    20%
src/infrastructure/llm/openai_llm_provider.py                                                      61     47    23%
src/infrastructure/logger.py                                                                      102     38    63%
src/infrastructure/mappers/__init__.py                                                              2      2     0%
src/infrastructure/mappers/utils.py                                                                 5      5     0%
src/infrastructure/rag/__init__.py                                                                 12      0   100%
src/infrastructure/rag/embedding_utils.py                                                           3      3     0%
src/infrastructure/rag/options.py                                                                  63     10    84%
src/infrastructure/rag/rag_config_provider.py                                                      74     74     0%
src/infrastructure/rag/steps/__init__.py                                                            0      0   100%
src/infrastructure/rag/steps/general/__init__.py                                                    0      0   100%
src/infrastructure/rag/steps/general/chunking/__init__.py                                           5      0   100%
src/infrastructure/rag/steps/general/chunking/character_document_chunker.py                        32     25    22%
src/infrastructure/rag/steps/general/chunking/code_document_chunker.py                            106     91    14%
src/infrastructure/rag/steps/general/chunking/document_chunker.py                                  13      3    77%
src/infrastructure/rag/steps/general/chunking/dummy_document_chunker.py                            21     21     0%
src/infrastructure/rag/steps/general/chunking/factory.py                                           41     23    44%
src/infrastructure/rag/steps/general/chunking/html_document_chunker.py                             95     83    13%
src/infrastructure/rag/steps/general/chunking/markdown_document_chunker.py                         76     65    14%
src/infrastructure/rag/steps/general/chunking/semantic_document_chunker.py                         34     27    21%
src/infrastructure/rag/steps/general/chunking/sentence_document_chunker.py                         70     58    17%
src/infrastructure/rag/steps/general/chunking/token_document_chunker.py                            55     45    18%
src/infrastructure/rag/steps/general/parsing/__init__.py                                            7      0   100%
src/infrastructure/rag/steps/general/parsing/document_parser.py                                    21      6    71%
src/infrastructure/rag/steps/general/parsing/docx_document_parser.py                               97     76    22%
src/infrastructure/rag/steps/general/parsing/factory.py                                            57     34    40%
src/infrastructure/rag/steps/general/parsing/html_document_parser.py                              114     90    21%
src/infrastructure/rag/steps/general/parsing/pdf_document_parser.py                                78     61    22%
src/infrastructure/rag/steps/general/parsing/text_document_parser.py                               59     46    22%
src/infrastructure/rag/steps/general/parsing/utils.py                                              18     18     0%
src/infrastructure/rag/steps/graph_rag/__init__.py                                                  0      0   100%
src/infrastructure/rag/steps/graph_rag/clustering/__init__.py                                       3      0   100%
src/infrastructure/rag/steps/graph_rag/clustering/detector.py                                      10      2    80%
src/infrastructure/rag/steps/graph_rag/clustering/factory.py                                       33     22    33%
src/infrastructure/rag/steps/graph_rag/clustering/leiden_detector.py                              104    104     0%
src/infrastructure/rag/steps/graph_rag/clustering/louvain_detector.py                              92     92     0%
src/infrastructure/rag/steps/graph_rag/entity_extraction/__init__.py                                4      0   100%
src/infrastructure/rag/steps/graph_rag/entity_extraction/entity_extractor.py                        9      2    78%
src/infrastructure/rag/steps/graph_rag/entity_extraction/factory.py                                37     24    35%
src/infrastructure/rag/steps/graph_rag/entity_extraction/llm_entity_extractor.py                   83     65    22%
src/infrastructure/rag/steps/graph_rag/entity_extraction/spacy_entity_extractor.py                 75     75     0%
src/infrastructure/rag/steps/graph_rag/relationship_extraction/__init__.py                          4      0   100%
src/infrastructure/rag/steps/graph_rag/relationship_extraction/dependency_parser_extractor.py      87     87     0%
src/infrastructure/rag/steps/graph_rag/relationship_extraction/factory.py                          37     24    35%
src/infrastructure/rag/steps/graph_rag/relationship_extraction/llm_relationship_extractor.py       83     69    17%
src/infrastructure/rag/steps/graph_rag/relationship_extraction/relationship_extractor.py            9      2    78%
src/infrastructure/rag/steps/vector_rag/__init__.py                                                 0      0   100%
src/infrastructure/rag/steps/vector_rag/embedding/__init__.py                                       3      0   100%
src/infrastructure/rag/steps/vector_rag/embedding/dummy_embedding_provider.py                      15     15     0%
src/infrastructure/rag/steps/vector_rag/embedding/factory.py                                       16      4    75%
src/infrastructure/rag/steps/vector_rag/embedding/ollama_vector_embedder.py                        64     48    25%
src/infrastructure/rag/steps/vector_rag/embedding/openai_embedding_provider.py                     24     24     0%
src/infrastructure/rag/steps/vector_rag/embedding/vector_embedder.py                               25      8    68%
src/infrastructure/rag/steps/vector_rag/reranking/__init__.py                                       8      0   100%
src/infrastructure/rag/steps/vector_rag/reranking/bm25_reranker.py                                 33     27    18%
src/infrastructure/rag/steps/vector_rag/reranking/cross_encoder_reranker.py                        34     24    29%
src/infrastructure/rag/steps/vector_rag/reranking/dummy_reranker.py                                 6      1    83%
src/infrastructure/rag/steps/vector_rag/reranking/factory.py                                       29     16    45%
src/infrastructure/rag/steps/vector_rag/reranking/no_reranker.py                                    6      1    83%
src/infrastructure/rag/steps/vector_rag/reranking/reranker.py                                       7      1    86%
src/infrastructure/rag/steps/vector_rag/reranking/rrf_reranker.py                                  13      7    46%
src/infrastructure/rag/store_manager.py                                                            40      2    95%
src/infrastructure/rag/workflows/__init__.py                                                        6      0   100%
src/infrastructure/rag/workflows/add_document/__init__.py                                           4      0   100%
src/infrastructure/rag/workflows/add_document/add_document_workflow.py                             13      4    69%
src/infrastructure/rag/workflows/add_document/factory.py                                           53     38    28%
src/infrastructure/rag/workflows/add_document/graph_rag_add_document_workflow.py                   89     89     0%
src/infrastructure/rag/workflows/add_document/vector_rag_add_document_workflow.py                  58     44    24%
src/infrastructure/rag/workflows/create_resources/__init__.py                                       4      0   100%
src/infrastructure/rag/workflows/create_resources/create_rag_resources_workflow.py                 12      4    67%
src/infrastructure/rag/workflows/create_resources/factory.py                                       31     20    35%
src/infrastructure/rag/workflows/create_resources/graph_rag_create_rag_resources_workflow.py       26     26     0%
src/infrastructure/rag/workflows/create_resources/vector_rag_create_rag_resources_workflow.py      56     40    29%
src/infrastructure/rag/workflows/query/__init__.py                                                  5      0   100%
src/infrastructure/rag/workflows/query/factory.py                                                  45     29    36%
src/infrastructure/rag/workflows/query/graph_rag_query_workflow.py                                 86     75    13%
src/infrastructure/rag/workflows/query/query_workflow.py                                           13      4    69%
src/infrastructure/rag/workflows/query/vector_rag_query_workflow.py                                71     55    23%
src/infrastructure/rag/workflows/remove_document/__init__.py                                        4      0   100%
src/infrastructure/rag/workflows/remove_document/factory.py                                        31     18    42%
src/infrastructure/rag/workflows/remove_document/graph_rag_remove_document_workflow.py             18     10    44%
src/infrastructure/rag/workflows/remove_document/remove_document_workflow.py                       11      4    64%
src/infrastructure/rag/workflows/remove_document/vector_rag_remove_document_workflow.py            19     10    47%
src/infrastructure/rag/workflows/remove_resources/__init__.py                                       4      0   100%
src/infrastructure/rag/workflows/remove_resources/factory.py                                       29     18    38%
src/infrastructure/rag/workflows/remove_resources/graph_rag_remove_rag_resources_workflow.py       18     18     0%
src/infrastructure/rag/workflows/remove_resources/remove_rag_resources_workflow.py                 11      4    64%
src/infrastructure/rag/workflows/remove_resources/vector_rag_remove_rag_resources_workflow.py      37     24    35%
src/infrastructure/sql_database.py                                                                 87     70    20%
src/infrastructure/storage/__init__.py                                                             23     23     0%
src/infrastructure/storage/factory.py                                                              24     24     0%
src/infrastructure/storage/file_system_storage.py                                                  78     78     0%
src/infrastructure/storage/s3_storage.py                                                           92     92     0%
src/infrastructure/storage/storage.py                                                              19     19     0%
src/infrastructure/types/__init__.py                                                                9      0   100%
src/infrastructure/types/common.py                                                                 39     14    64%
src/infrastructure/types/document.py                                                               15      0   100%
src/infrastructure/types/errors.py                                                                 38      0   100%
src/infrastructure/types/graph.py                                                                  65      0   100%
src/infrastructure/types/pagination.py                                                             46     15    67%
src/infrastructure/types/rag.py                                                                    20      1    95%
src/infrastructure/types/retrieval.py                                                               8      0   100%
src/infrastructure/validation/__init__.py                                                           2      2     0%
src/infrastructure/validation/utils.py                                                             24     24     0%
src/infrastructure/vector_stores/__init__.py                                                        4      0   100%
src/infrastructure/vector_stores/factory.py                                                        31     17    45%
src/infrastructure/vector_stores/qdrant_vector_store.py                                           126    106    16%
src/infrastructure/vector_stores/vector_store.py                                                   23      8    65%
src/infrastructure/wikipedia/__init__.py                                                            2      2     0%
src/infrastructure/wikipedia/fetch.py                                                             137    137     0%
-------------------------------------------------------------------------------------------------------------------
TOTAL                                                                                            8169   6815    17%


============================== 32 passed in 8.96s ==============================
============================= test session starts ==============================
platform linux -- Python 3.13.7, pytest-8.4.2, pluggy-1.6.0 -- /home/nate/.cache/pypoetry/virtualenvs/insighthub-G9Cf3wlO-py3.13/bin/python
cachedir: .pytest_cache
rootdir: /home/nate/projects/insighthub
configfile: pyproject.toml
plugins: anyio-4.11.0, returns-0.26.0, cov-4.1.0
collecting ... collected 88 items

tests/integration/test_chat_session_data_access.py::TestChatSessionDataAccessIntegration::test_create_and_get_session PASSED [  1%]
tests/integration/test_chat_session_data_access.py::TestChatSessionDataAccessIntegration::test_get_sessions_by_workspace PASSED [  2%]
tests/integration/test_chat_session_data_access.py::TestChatSessionDataAccessIntegration::test_update_session PASSED [  3%]
tests/integration/test_chat_session_data_access.py::TestChatSessionDataAccessIntegration::test_delete_session PASSED [  4%]
tests/integration/test_chat_session_orchestrator.py::TestSessionOrchestratorIntegration::test_create_session_success PASSED [  5%]
tests/integration/test_chat_session_orchestrator.py::TestSessionOrchestratorIntegration::test_create_session_validation_failure PASSED [  6%]
tests/integration/test_chat_session_orchestrator.py::TestSessionOrchestratorIntegration::test_list_sessions_success PASSED [  7%]
tests/integration/test_chat_session_orchestrator.py::TestSessionOrchestratorIntegration::test_list_sessions_validation_failure PASSED [  9%]
tests/integration/test_chat_session_orchestrator.py::TestSessionOrchestratorIntegration::test_select_session_success PASSED [ 10%]
tests/integration/test_chat_session_orchestrator.py::TestSessionOrchestratorIntegration::test_select_session_not_found PASSED [ 11%]
tests/integration/test_chat_session_orchestrator.py::TestSessionOrchestratorIntegration::test_delete_session_success PASSED [ 12%]
tests/integration/test_chat_session_orchestrator.py::TestSessionOrchestratorIntegration::test_delete_session_not_found PASSED [ 13%]
tests/integration/test_default_rag_config_data_access.py::TestDefaultRagConfigDataAccessIntegration::test_get_default_rag_config_returns_none_when_not_set PASSED [ 14%]
tests/integration/test_default_rag_config_data_access.py::TestDefaultRagConfigDataAccessIntegration::test_update_and_get_default_rag_config PASSED [ 15%]
tests/integration/test_default_rag_config_service.py::TestDefaultRagConfigServiceIntegration::test_get_config_returns_none_when_not_set PASSED [ 17%]
tests/integration/test_default_rag_config_service.py::TestDefaultRagConfigServiceIntegration::test_create_or_update_config_initial_vector PASSED [ 18%]
tests/integration/test_default_rag_config_service.py::TestDefaultRagConfigServiceIntegration::test_create_or_update_config_initial_graph PASSED [ 19%]
tests/integration/test_default_rag_config_service.py::TestDefaultRagConfigServiceIntegration::test_create_or_update_config_update_vector PASSED [ 20%]
tests/integration/test_default_rag_config_service.py::TestDefaultRagConfigServiceIntegration::test_create_or_update_config_update_graph PASSED [ 21%]
tests/integration/test_default_rag_config_service.py::TestDefaultRagConfigServiceIntegration::test_create_or_update_config_switch_rag_type PASSED [ 22%]
tests/integration/test_document_data_access.py::TestDocumentDataAccessIntegration::test_create_and_get_document PASSED [ 23%]
tests/integration/test_document_data_access.py::TestDocumentDataAccessIntegration::test_get_documents_by_workspace PASSED [ 25%]
tests/integration/test_document_data_access.py::TestDocumentDataAccessIntegration::test_update_document PASSED [ 26%]
tests/integration/test_document_data_access.py::TestDocumentDataAccessIntegration::test_delete_document PASSED [ 27%]
tests/integration/test_document_service.py::TestDocumentServiceIntegration::test_upload_and_process_document_fs_success PASSED [ 28%]
tests/integration/test_document_service.py::TestDocumentServiceIntegration::test_upload_and_process_document_fs_workspace_not_found PASSED [ 29%]
tests/integration/test_document_service.py::TestDocumentServiceIntegration::test_remove_document_fs_success PASSED [ 30%]
tests/integration/test_document_service.py::TestDocumentServiceIntegration::test_list_documents_by_workspace PASSED [ 31%]
tests/integration/test_document_service.py::TestDocumentServiceIntegration::test_get_document_by_id PASSED [ 32%]
tests/integration/test_graph_rag_workflow.py::TestGraphRagWorkflowIntegration::test_add_document_workflow_success PASSED [ 34%]
tests/integration/test_graph_rag_workflow.py::TestGraphRagWorkflowIntegration::test_query_workflow_after_adding_document PASSED [ 35%]
tests/integration/test_graph_rag_workflow.py::TestGraphRagWorkflowIntegration::test_delete_workspace_graph PASSED [ 36%]
tests/integration/test_graph_rag_workflow.py::TestGraphRagWorkflowIntegration::test_community_detection_integration PASSED [ 37%]
tests/integration/test_neo4j_graph_store.py::TestNeo4jGraphStoreIntegration::test_create_and_drop_constraint PASSED [ 38%]
tests/integration/test_neo4j_graph_store.py::TestNeo4jGraphStoreIntegration::test_create_index PASSED [ 39%]
tests/integration/test_neo4j_graph_store.py::TestNeo4jGraphStoreIntegration::test_upsert_entity_and_get_by_id PASSED [ 40%]
tests/integration/test_neo4j_graph_store.py::TestNeo4jGraphStoreIntegration::test_upsert_entity_updates_existing PASSED [ 42%]
tests/integration/test_neo4j_graph_store.py::TestNeo4jGraphStoreIntegration::test_upsert_relationship PASSED [ 43%]
tests/integration/test_neo4j_graph_store.py::TestNeo4jGraphStoreIntegration::test_upsert_community PASSED [ 44%]
tests/integration/test_neo4j_graph_store.py::TestNeo4jGraphStoreIntegration::test_find_entities PASSED [ 45%]
tests/integration/test_neo4j_graph_store.py::TestNeo4jGraphStoreIntegration::test_delete_document_graph PASSED [ 46%]
tests/integration/test_neo4j_graph_store.py::TestNeo4jGraphStoreIntegration::test_export_subgraph PASSED [ 47%]
tests/integration/test_neo4j_graph_store.py::TestNeo4jGraphStoreIntegration::test_traverse_graph PASSED [ 48%]
tests/integration/test_neo4j_graph_store.py::TestNeo4jGraphStoreIntegration::test_delete_workspace_graph PASSED [ 50%]
tests/integration/test_qdrant.py::TestQdrantIntegration::test_qdrant_container_starts PASSED [ 51%]
tests/integration/test_qdrant.py::TestQdrantIntegration::test_qdrant_client_connection PASSED [ 52%]
tests/integration/test_qdrant_vector_store.py::TestQdrantVectorStoreIntegration::test_add_and_search PASSED [ 53%]
tests/integration/test_qdrant_vector_store.py::TestQdrantVectorStoreIntegration::test_add_batch PASSED [ 54%]
tests/integration/test_qdrant_vector_store.py::TestQdrantVectorStoreIntegration::test_delete_by_filter PASSED [ 55%]
tests/integration/test_qdrant_vector_store.py::TestQdrantVectorStoreIntegration::test_clear_collection PASSED [ 56%]
tests/integration/test_qdrant_vector_store.py::TestQdrantVectorStoreIntegration::test_search_with_filters PASSED [ 57%]
tests/integration/test_rag_options_integration.py::test_get_all_options_returns_success_with_all_options PASSED [ 59%]
tests/integration/test_redis_cache.py::TestRedisCacheIntegration::test_cache_connection PASSED [ 60%]
tests/integration/test_redis_cache.py::TestRedisCacheIntegration::test_set_and_get PASSED [ 61%]
tests/integration/test_redis_cache.py::TestRedisCacheIntegration::test_get_nonexistent_key PASSED [ 62%]
tests/integration/test_redis_cache.py::TestRedisCacheIntegration::test_delete PASSED [ 63%]
tests/integration/test_redis_cache.py::TestRedisCacheIntegration::test_exists PASSED [ 64%]
tests/integration/test_redis_cache.py::TestRedisCacheIntegration::test_clear PASSED [ 65%]
tests/integration/test_s3_storage.py::TestS3BlobStorageIntegration::test_s3_connection PASSED [ 67%]
tests/integration/test_s3_storage.py::TestS3BlobStorageIntegration::test_upload_and_download PASSED [ 68%]
tests/integration/test_s3_storage.py::TestS3BlobStorageIntegration::test_download_nonexistent_object PASSED [ 69%]
tests/integration/test_s3_storage.py::TestS3BlobStorageIntegration::test_delete PASSED [ 70%]
tests/integration/test_s3_storage.py::TestS3BlobStorageIntegration::test_exists PASSED [ 71%]
tests/integration/test_s3_storage.py::TestS3BlobStorageIntegration::test_get_url PASSED [ 72%]
tests/integration/test_sql_database.py::TestSqlDatabaseIntegration::test_database_connection_and_health_check PASSED [ 73%]
tests/integration/test_sql_database.py::TestSqlDatabaseIntegration::test_execute_and_fetch_operations PASSED [ 75%]
tests/integration/test_sql_database.py::TestSqlDatabaseIntegration::test_execute_with_no_results PASSED [ 76%]
tests/integration/test_sql_database.py::TestSqlDatabaseIntegration::test_fetch_one_with_no_results PASSED [ 77%]
tests/integration/test_sql_database.py::TestSqlDatabaseIntegration::test_fetch_all_with_no_results PASSED [ 78%]
tests/integration/test_sql_database_error_handling.py::TestSqlDatabaseErrorHandlingIntegration::test_init_raises_database_exception_on_connection_failure PASSED [ 79%]
tests/integration/test_sql_database_error_handling.py::TestSqlDatabaseErrorHandlingIntegration::test_execute_raises_database_exception_on_invalid_query PASSED [ 80%]
tests/integration/test_sql_database_error_handling.py::TestSqlDatabaseErrorHandlingIntegration::test_fetch_one_raises_database_exception_on_invalid_query PASSED [ 81%]
tests/integration/test_sql_database_error_handling.py::TestSqlDatabaseErrorHandlingIntegration::test_fetch_all_raises_database_exception_on_invalid_query PASSED [ 82%]
tests/integration/test_sql_database_error_handling.py::TestSqlDatabaseErrorHandlingIntegration::test_execute_raises_database_exception_on_constraint_violation PASSED [ 84%]
tests/integration/test_state_data_access.py::TestStateDataAccessIntegration::test_get_initial_state PASSED [ 85%]
tests/integration/test_state_data_access.py::TestStateDataAccessIntegration::test_set_and_get_workspace PASSED [ 86%]
tests/integration/test_state_data_access.py::TestStateDataAccessIntegration::test_set_and_get_session PASSED [ 87%]
tests/integration/test_state_data_access.py::TestStateDataAccessIntegration::test_cache_invalidation_on_set PASSED [ 88%]
tests/integration/test_storage_factory.py::TestStorageFactoryIntegration::test_create_blob_storage_filesystem PASSED [ 89%]
tests/integration/test_storage_factory.py::TestStorageFactoryIntegration::test_create_blob_storage_s3 PASSED [ 90%]
tests/integration/test_storage_factory.py::TestStorageFactoryIntegration::test_create_blob_storage_unsupported_type PASSED [ 92%]
tests/integration/test_storage_factory.py::TestStorageFactoryIntegration::test_create_blob_storage_s3_missing_params PASSED [ 93%]
tests/integration/test_vector_rag_workflow.py::TestVectorRagWorkflowIntegration::test_add_document_and_query_workflow_success PASSED [ 94%]
tests/integration/test_workspace_data_access.py::TestWorkspaceDataAccessIntegration::test_create_and_get_workspace_no_cache_returns_expected_workspace PASSED [ 95%]
tests/integration/test_workspace_data_access.py::TestWorkspaceDataAccessIntegration::test_create_workspace_returns_success_and_workspace PASSED [ 96%]
tests/integration/test_workspace_data_access.py::TestWorkspaceDataAccessIntegration::test_update_workspace_returns_success_and_updates_data PASSED [ 97%]
tests/integration/test_workspace_data_access.py::TestWorkspaceDataAccessIntegration::test_delete_workspace_returns_success_and_removes_data PASSED [ 98%]
tests/integration/test_workspace_data_access.py::TestWorkspaceDataAccessIntegration::test_get_all_workspaces_returns_all_created_workspaces PASSED [100%]

=============================== warnings summary ===============================
tests/integration/test_qdrant.py::TestQdrantIntegration::test_qdrant_client_connection
  /home/nate/.cache/pypoetry/virtualenvs/insighthub-G9Cf3wlO-py3.13/lib/python3.13/site-packages/testcontainers/qdrant/__init__.py:82: UserWarning: Qdrant client version 1.16.1 is incompatible with server version 1.9.1. Major versions should match and minor version difference must not exceed 1. Set check_compatibility=False to skip version check.
    return QdrantClient(

-- Docs: https://docs.pytest.org/en/stable/how-to/capture-warnings.html
=================== 88 passed, 1 warning in 63.39s (0:01:03) ===================
============================= test session starts ==============================
platform linux -- Python 3.13.7, pytest-8.4.2, pluggy-1.6.0 -- /home/nate/.cache/pypoetry/virtualenvs/insighthub-G9Cf3wlO-py3.13/bin/python
cachedir: .pytest_cache
rootdir: /home/nate/projects/insighthub
configfile: pyproject.toml
plugins: anyio-4.11.0, returns-0.26.0, cov-4.1.0
collecting ... collected 256 items

tests/e2e/cli/test_chat.py::TestChatCLI::test_chat_list_empty PASSED     [  0%]
tests/e2e/cli/test_chat.py::TestChatCLI::test_chat_create_with_title PASSED [  0%]
tests/e2e/cli/test_chat.py::TestChatCLI::test_chat_create_without_title PASSED [  1%]
tests/e2e/cli/test_chat.py::TestChatCLI::test_chat_list_with_sessions PASSED [  1%]